{
  "id": "q21",
  "round": "round-02",
  "cards": {
    "datus": {
      "metric": "缴款→缴入国库全程耗时分档的笔数分布（2026 年，近似口径）",
      "caliber": "指标目录无耗时分档指标：全程闭环按 缴库金额/批次数×（fstatus×income_status）状态切片（2026 年仅 1 笔 100 元走完全程）；最近似分档='缴款→清分'耗时（38 笔已清分，由缴款日×清分日日期对推算：当日 30、1 天 1、6 天 3、9 天 2、22 天 1、43/47 天各 1；另有 24 笔未清分无终点）。自述：缴库↔缴款跨链逐笔配对维度被语义模型拒绝",
      "dimensions": "按耗时档分组（缴款→清分近似）",
      "time_window": "锚点=开票日 fill_date 与清分日 fcleardate；窗口 2026 年",
      "values": {
        "全程闭环(当日)": 1,
        "缴款→清分当日": 30,
        "缴款→清分1天": 1,
        "缴款→清分2~7天": 3,
        "缴款→清分8~15天": 2,
        "缴款→清分16~30天": 1,
        "缴款→清分30天以上": 2,
        "未清分(无终点)": 24
      }
    },
    "cube": {
      "metric": "缴款→缴入国库全程耗时分档的笔数分布（2026 年）",
      "caliber": "cube 侧 nomatch：语义层无环节耗时/日期差类知识（未建模），无作答",
      "dimensions": null,
      "time_window": "不适用（无作答）",
      "values": null
    }
  },
  "comparison": {
    "metrics": [
      {
        "name": "全程耗时分档分布",
        "caliber_same": null,
        "value_same": null,
        "note": "cube 侧 nomatch，无口径可比；datus 以'缴款→清分'日期对近似分档并明示全程闭环仅 n=1（不具统计意义），口径自洽。"
      }
    ],
    "summary": "单侧作答（cube nomatch）：datus 用'缴款→清分'近似分档（38 笔，78.9% 当日），全程闭环仅 1 笔；待人工确认近似口径作为回归基准，并两侧补环节耗时建模。"
  },
  "verdict": "待人工",
  "verdict_detail": [
    {
      "side": "cube",
      "type": "补指标",
      "target": "环节耗时/日期差类指标（全程闭环耗时分档）",
      "suggest": "语义层补环节日期字段与间隔类口径（缴款→清分→划拨→缴库），复验时该题应可作答"
    },
    {
      "side": "datus",
      "type": "补维度",
      "target": "缴库↔缴款跨链逐笔配对维度（被语义模型拒绝）",
      "suggest": "为缴库侧补建缴款日期时间轴/配对键，使全程逐笔耗时分档可查（当前只能状态切片+缴款→清分近似）"
    }
  ],
  "corrected": {
    "answer": "2026 年走完全程（缴款→缴入国库）的仅 1 笔（100 元，当日闭环），全程分档无统计意义；最近似口径'缴款→清分'耗时（38 笔已清分）：当日 30 笔（78.9%）、1 天 1 笔、2~7 天 3 笔、8~15 天 2 笔、16~30 天 1 笔、30 天以上 2 笔；另有 24 笔未清分无耗时终点。",
    "basis": "倾向采纳 datus 作答卡（缴款日×清分日日期对推算，SQL 有执行记录取证；全程闭环 n=1 的局限已自述）；cube 侧 nomatch，无对照证据"
  },
  "evidence_refs": [
    "rounds/round-02/answers/datus/q21.json",
    "rounds/round-02/answers/cube/q21.json"
  ]
}
