{
  "id": "q28",
  "round": "round-02",
  "cards": {
    "datus": {
      "metric": "2026 年缴款→缴入国库分环节时效归因",
      "caliber": "以各环节状态积压近似耗时：2026 缴款 1,498.53 万元/63 笔，96.8% 开票当日到账（缴款/银行代收不慢）；金额口径清分率 0.0884%（被 1,496 万元未到账汇缴大票拖累，笔数口径 39/63 已清分）；划拨 424 元；缴库侧未缴库（fstatus=0）2,933.89 万元/15 批次占 99.89%，走完全链条仅 100 元/1 批次；自述跨环节金额锚不同轴不可直接相加，trans_date/enter_date 近全空无法计天数",
      "dimensions": "按环节（开票缴款/银行代收到账/清分汇总/划拨/缴库）拆解",
      "time_window": "2026-01-01 ~ 2026-10-23（当年）",
      "values": {
        "结论": "慢在划拨→缴库末端",
        "缴库侧未缴库占比": "99.89%（2,933.89 万元 / 15 批次）",
        "全程闭环": "仅 100 元 / 1 批次",
        "到账率": "96.8%（61/63 笔，当日到账）"
      }
    },
    "cube": {
      "metric": "2026 年缴款→缴入国库分环节时效归因",
      "caliber": "cube 侧 nomatch：语义层无环节拆解/时效类口径（未建模），无作答",
      "dimensions": null,
      "time_window": "不适用（无作答）",
      "values": null
    }
  },
  "comparison": {
    "metrics": [
      {
        "name": "分环节时效归因",
        "caliber_same": null,
        "value_same": null,
        "note": "cube nomatch（26.1s），无口径可比；datus 以状态积压近似完成五环节归因，结论自洽且自述局限清晰（跨环节金额不同轴、耗时字段近全空、约 16% 测试数据）。"
      }
    ],
    "summary": "单侧作答（cube nomatch）：datus 判定慢在划拨→缴库末端（99.89% 停'未缴库'）；待人工确认作为回归基准。"
  },
  "verdict": "待人工",
  "verdict_detail": [
    {
      "side": "cube",
      "type": "补指标",
      "target": "环节拆解/状态积压类口径（缴款→到账→清分→划拨→缴库各环节状态占比）",
      "suggest": "语义层补各环节状态维度与积压口径，复验时该题应可作答"
    }
  ],
  "corrected": {
    "answer": "2026 年从缴款到缴入国库整体偏慢主要慢在划拨→缴库末端：缴库侧 2,937.22 万元中 99.89%（2,933.89 万元/15 批次）停在'未缴库'，全年走完'已缴库+国库确认'全程的仅 1 笔 100 元；缴款与银行代收环节不慢（96.8% 缴款开票当日到账）；清分汇总仅'名义慢'（笔数 62% 已清分，金额清分率 0.09% 系被 1,496 万元未到账汇缴大票拖累的结构性结果）。",
    "basis": "倾向采纳 datus 作答卡（五环节状态积压拆解，SQL 有执行记录取证；跨环节金额不同轴、耗时字段近全空等局限已自述）；cube 侧 nomatch，无对照证据"
  },
  "evidence_refs": [
    "rounds/round-02/answers/datus/q28.json",
    "rounds/round-02/answers/cube/q28.json"
  ]
}
